TextID,Sentence
29,"Поп разинул большой рот, крикнул густо:

— Еще чадо, лупи его заодно!"
29,"Грузный человек поднял его за шиворот, приблизил к своему лицу — медному, потному, обдал жарким перегаром:

— Зачем пришел?"
29,"Кал еси, вонь еси, пес еси смрадный…»

— Псы!"
29,"На дворе на желтых от мочи сугробах, на навозе валяются пьяные, — у кого в кровь разбита рожа, у кого сняли сапоги, шапку."
29,"Алешке приснилась мать, — стоит в дыму посреди избы и плачет, не зажмуривая глаз, и все к голове подносит руки, жалуется… Алешка истосковался во сне."
29,"У косящатого окошечка, касаясь потолочного свода горлатными шапками, стояли Хованский и Иван Михайлович Милославский, царевнин дядя, — широкоскулый, с глазами-щелками, весь потный, в новой, дарованной шубе, весь налитой кровью от сытости и волнения."
29,"Ан — ведут нагого человека, — плоть-то у него вся смрад и зело дурна, огнем дышит, изо рта, из ноздрей и из ушей пламя смрадное исходит."
29,"Сердце резало, пот застилал глаза."
29,"Петр позвал, стоя под липой, — весь в пыли, в земле, потный, как мужичонок:

— Никита, напиши указ… Мужики мои никуда не годятся, понеже старые, глупые… Скорее!"
29,"Все еще бешено глядя в глаза Лефорту, будто боясь увидеть в толпе кого-то, — проговорил задыхающимся голосом:

— Мейн либер генерал, привез великого посла с великим виватом от еллинского бога Бахуса… — Крупный пот выступил на лице его, облизнул губы и, все еще глядя в глаза, с трудом: — Мит херцлихен грус… Сиречь, бьет челом… Свиней и карету в подарок шлет… — Все еще судорожно держа Зотова, шепотом: — Вались на колени, кланяйся…

Прекрасный, в розовом бархате, в кружевах, напудренный и надушенный Лефорт все сразу понял… Подняв высоко руки, захлопал в ладоши, залился веселым смехом и, поворачиваясь то к Петру, то к гостям, сказал:

— Вот прекрасная шутка, — веселее шутки не приходилось видеть… Мы думали поучить его забавным шуткам, но он поучит нас шутить."
29,"Табачный дым клубился в лучах, бивших сквозь круглые окошки двухсветной залы."
29,"Он мотал головой, бурча: «Не умею, нет, не могу…» Тогда фрау Шимельпфениг, сопровождаемая Лефортом, подала ему букет, — это означало, что его выбирали в короли танцев."
29,Сумерки затягивало пороховым дымом.
29,Вековечной тоской пахнул дым костров из сухого навоза.
29,"Дрожащими ноздрями втягивал сладкие женские духи, приятные запахи трубочного табаку и пива."
29,"Алексашка танцевал с почтенными дамами, кои за возрастом праздно сидели у стен, — трудился до седьмого пота, красавец."
29,"За окнами шумел ветер, летя через тысячеверстные равнины, лесную да болотную глушь, лишь задерет солому на курной избе, да повалит пьяного мужика в сугроб, да звякнет мерзлым колоколом на покосившейся колокольне… А здесь — взлохмачены парики, красные лица, дым валит из длинных трубок, трещат свечи."
29,"Иные вытирали пот, иные вертели пальцами, отдувались."
29,Вкруг дымящегося навоза суетились воробьи.
29,"Под кисейным пологом на подушке раскинуты волосы жаркими прядями, лоб и глаза Анхен прикрыты мокрым полотенцем, жаркий рот обметало… Петр вышел на цыпочках и вдове в судорожные ладони высыпал пригоршню червонных (Сонькин подарок Петру на свадьбу)… Алексашке ведено день и ночь дежурить у вдовы, если будет нужда — в аптеку, или больная запросит какой-нибудь еды заморской, чтобы достать из-под земли…

Протопоп и поп Витка не жалели ладана, свечи виднелись, как в тумане, иерихонским ревом долголетие возглашал дьякон."
29,"Василий Васильевич поднес платочек к носу, чтобы не слышать бараньего татарского смрада, приказал допросить."
29,"— надрывно грохнули пушки, затрещали мушкеты, — все закрылось клубами белого дыма."
29,"Содрогнувшись, перекрестил это место…

Стреляли более часу… Когда развеялся дым, на равнине билось несколько лошадей, валялось до сотни трупов."
29,"— За тобой, государь, — строго ответствовал Лев Кириллович, — и не за милостью какой-нибудь, а такие сейчас дела, что быть тебе в Москве непременно, без тебя не вернусь…

Полное лицо Льва Кирилловича задрожало, на висках из-под шапки выступил пот."
29,"Сзади шел Гладкий, от него несло перегаром."
29,"Просунул боком голову в волоковое окошечко, стал кричать, — глотку забило дымом… Хворост, разгораясь, затрещал, зашумел… Между бревен осветились щели."
29,"— Ах, ах… А мы Борису верим…

— Верь, да оглядывайся…

— Ах, ах…



22

В курной избе топилась печь, дым стоял такой, что человека было видно лишь по пояс, а на полатях вовсе не видно."
29,"От вони, от ребячьего писку кружилось в голове, дым ел глаза."
29,"И не раз почему-то на память приходил проклятый колдун, в ушах завяз его крик (из окошка сквозь огонь): «Отчини двеееерь, пропадешь, пропадешь…»

Поздно вечером ввалился в избу урядник со стражей, закашлялся от дыма и — беременной бабе:

— Стоит у вас на дворе Васька Голицын?"
29,"Даже запах от платья Лефорта был не русский, иной, весьма приятный…

Петр хотел, чтобы дом его любимца стал островком этой манящей иноземщины, — для царского веселья украшался Лефортов дворец."
29,"Жар шел от синей муравленой печи, пахло ладаном и воском."
29,"Вспомнил — летом в раскрытые окна доносилось дребезжание колокола на немецкой кирке… В этом раннем звоне — честность и порядок, запах опрятных домиков на Кукуе, кружевная занавеска на окне Анны Монс… Ты и ее тоже бы сжег, живой мертвец, черный ворон!"
29,Тогда он побагровел до пота.
29,"Медленно поднимались дымы, — хозяйки затопили печи."
29,"Яснее проступали крутые крыши между серебряными березами, крутилось розовыми дымами все Заречье; крепкие дворы стрельцов, высокие амбары гостинодворцев, домики разного посадского люда, — кожевников, чулошников, квасельников…

Суетливая галка прыгала по ветвям, порошила глаза снегом."
29,"Около торчал столб для площадной казни, и белым дымом курился костер, где калилось железо."
29,От подожженного с четырех концов сруба валил серый дым.
29,"Дым медленно уплывал в небо…

— Он наперед угорит, дрова-то сырые…

— Немец, немец, а тоже — гореть заживо… ох, господи…

— Грамоте учился, писал тетради, и вот — на тебе…

Из кожаного возка, — теперь все различали, — глядело сквозь окошечко на дым, на взлизывающие языки огня мертвенное лицо, будто сошедшее с древнеписанной иконы…

— Гляди, очами-то сверкает, — страх-то!.."
29,"Это проговорил Овдоким, — звонко, бесстрашно… Все, кто стоял около него, отстранились, не отошли только Иуда и Цыган… Топоча клюками, он опять:

— Что же из того — еретик… Как умеет, так и верует… По-нашему ему не способно, — скажем… И за это гори… В муках живем, в пытках…

Огромный костер шумел и трещал, искры и дым завивало воронкой."
29,"Снег, размешанный с навозом, уже не скрипел под полозьями."
29,"Из крепости лили грязь и воду с дерьмом, пихались шестами с горящей на конце паклей, рубились тупыми саблями."
29,"Вся кумпания, не разбирая места, кидалась к столам, требовала капусты, печеных яиц, колбас, водки с перцем, девок-плясиц… Дом ходил ходуном, в табачном дыму, в чаду пили до изумления, а хозяин пил вдвое, — если не мог — вливали силой…

Что ни родовитее хозяин — страннее придумывали над ним шутки."
29,В ответ на царский салют все иноземные корабли окутались дымом.
29,"Казалось — берега затряслись… У Петра горели глаза, повторял: «Хорошо, хорошо…» Будто ожили его детские картинки… Когда дым уплыл, на левом берегу, на причальной стенке показались иностранцы, — махали шляпами… Ван Лейден и Пельтенбург… Петр сорвал треугольную шляпу, весело замахал в ответ, крикнул приветствие… Но сейчас же, — видя напряженные лица Апраксина, Ромодановского, премудрого дьяка Виниуса, — сердито отвернулся…

…Сидя на кровати, он глядел на серый полусвет за окошком."
29,"Раскурив трубку, глубоко вдыхал дым… Непроворотное бытие!.."
29,"В баньке тебя попарим по-нашему, по-мужичьему, квасом поддадим, росным ладаном умоем, — хоть нюхай тебя где хошь… А для мужиков первое дело — дух… И ты, красавица, встречь его слов непрестанно смейся, чтоб у тебя все тряслось, хохочи тихо, мелко — грудью… Мертвый от этого обезумеет."
29,"Девки с бабой Воробьихой положили царицу на полок, веяли на нее вениками, омоченными в мяте и росном ладане."
29,"Подкинулась: «Кто тут, кто тут?..» Спросонок не поняла — кто навалился… Разобрав, застонала от еще живой обиды, прижала кулаки к глазам… Петруша на человека не был похож, пьяный, табачный, прямо от девки немки — к ней, заждавшейся… Не ласкал, насильничал, молча, страшно… Стоило росным ладаном мыться!"
29,"Сквозь закопченные двери видно — летят искры, из горна, там — люди, голые по пояс, размахиваясь кругом, куют полосу, там — многопудовый молот от мельничного колеса падает на болванку, и брызжет нагар в кожаные фартуки, там у верстаков — слесаря… Из ворот по доскам на крышу приземистой печи тянутся тачки с углем, огонь и черный дым выбрасываются из домны."
29,"Чадо, Александра, — позвал он жалобным голосом, — выдь к нам… Алеша, сходи за сестрой… Не в нужном ли она чулане сидит, — животом скорбная, это забыл, простите… Приведи невесту…

Волков рванулся было из-за стола."
29,"Не мешкая… Азов возьмем с налету…



На шестые сутки на рассвете в хате Стрешнева в табачном дыму написали письмо князю-кесарю:

«Мин хер кениг… Отец твой великий господин святейший кир Аникита, архиепископ прешпургский и всеа Яузы и всего Кукуя патриарх, такожде и холопи твои генералы Антоном Михайлович и Франц Яковлевич с товарищи — в добром здоровии, и нынче из Паншина едем в путь в добром же здоровии… В марсовом ярме непрестанно труждаемся."
29,"Дым отнесло, ни татар, ни турок не было видно."
29,"Косматое солнце заливало нестерпимым жаром, звенели кузнечики, липли мухи, воняло дерьмо, от зноя зыбкими казались азовские стены и башни."
29,"Захваченный редут окутался дымом, — турки стреляли, прикрывая отступление: они увозили пушки, бегом по склону к крепости."
29,"Вывалилась толпа янычар, и кто-то — на белом коне, весь в красном, в большой чалме — раскинул вздетые руки… Сквозь выстрелы донесся такой страшный вой, что Петр содрогнулся… Русские уже бежали назад, за ними — конные и пешие турки… Падали, падали, Петр схватился за виски… Снова увидел Алексашку: он мчался к тому — в красном, в чалме, — сшиблись… Клубы порохового дыма… Разрывы бомб… Взбесившиеся лошади."
29,"Алеша Бровкин слушал, разинув светлые глаза и безусый рот… Петр дунул ему в рот дымом."
29,"Сели за дубовые чистые столы, дивясь опрятности и хорошему запаху, стали пить пиво."
29,"Так сподеваются, что — нигде… Биржа, которая вся сделана из камня белого и внутри вся нарезана алебастром — зело пречудно… Пол сделан, как на шахматной доске, и каждый купец стоит на своем квадрате… И так на всякий день здесь бывает много народу, что на всей той площади ходят с великой теснотою… И бывает там крик великий… Некоторые люди, — которые из жидов — бедные, — ходят между купцами и дают нюхать табак, кому сгоряча надобно, — и тем кормятся…»



Яков Номен, любознательный голландец, записал в дневнике:

«…Царю не более недели удалось прожить инкогнито: некоторые, бывшие в Московии, узнали его лицо."
29,"Четвертый раз прогрохотали орудия, густым дымом окутался холм."
29,В солнечных лучах переливался табачный дым.
29,"Константин, брат Овсея, с третьей крови сказал, что письмо они, стрельцы, затоптали в навоз под средней башней Нового Иерусалима."
29,"Печной дым стлало к земле, горячим хлебом запахло в кривых переулках."
29,"Босой, вприскочку, бежал юродивый, — вонючий, спина голая, в голове еще с лета — репьи."
29,"Теперь вся Москва поняла, откуда смрадом тянет…»

Мужик мигал веками, не разобрать, верил ли, нет ли… Пегобородый, усмехаясь, грыз чеснок."
29,В каких книгах читано — человеку глотать дым?
29,Повсюду — кучи золы и навоза.
29,"За дымами, за голыми деревами постно ударил колокол."
29,Клубы белого порохового дыма застилали солнечное небо.
29,"Был светел день, нашла туча, все житие наше смрадом покрыла… (Оглянулся через правое, через левое плечо, будто не стоит ли кто за ним."
29,"Над стенами крепости — на правой стороне реки, напротив Воронежа, — взлетали клубы порохового дыма, ветер рвал их в клочья."
29,Стлался табачный дым из трубок.
29,"Кузнецы в прожженных фартуках, в соленых от пота рубахах, рослые молотобойцы, по пояс голые, с опаленной кожей, закопченные мальчишки, раздувающие мехи, — все валились с ног, отмахивали руки, почернели."
29,"Омахивая пот, свистя легкими, воздуходувы раскачивали рычаги шести мехов."
29,"Но Петр не сразу прошел туда, — с удовольствием закрутив носом от тепла и табачного дыма, нагнулся над столом, оглядывая блюда."
29,"Семнадцатого с левого борта на ногайской стороне показались тонкие минареты Тамани, флот пересек пролив и с пальбою, окутавшись пороховым дымом, прошел в виду Керчи, стал на якорь."
29,"Турки, видимо, переполошились, — не ждали, не гадали увидеть весь залив, полный парусов и пушечного дыма."
29,Тянуло запахом маслин и роз.
29,Трубочный дым слоился в безветрии над палубой.
29,"Над спящим Константинополем будто обрушилось небо от грохота… «Крепость», окутанный дымом, дал второй залп…



Емельян Украинцев писал цифирью:

«…припал на самого султана и на весь народ великий страх: капитан Памбург пил целый день на корабле с моряками и подпил гораздо и стрелял с корабля в полночь изо всех пушек не однажды."
29,Одно счастье — ушли от никонианского смрада.
29,"Из огня — слышим — сладкогласное пение… А сверху-то в дыму — черти, как сажа, крутятся, визжат, — верите ли?"
29,— Человек вплоть задышал чесночным перегаром.
29,"Будучи любознателен, упросил я одного знакомца сводить меня во дворец под видом будто бы продавца аравийских ароматов."
29,"Смрад, валяются пьяные."
29,"Когда посольский поезд остановился, генерал поднял руку, — ударили пушки, дымом заволокло подслеповатые окна приказов, церковные главы."
29,"Старый аристократ снимал очки и, потерев печальные глаза, торжественно проходил в столовую залу, потемневшую от дыма минувшей славы."
29,Запах мускуса привлек наконец внимание короля.
29,А давно ли косила сама и навоз возила.
29,"Тихий дым валил из щели под крышей, поднимался над лесом в серое небо."
29,"Отплываем… В царствие небесное… Детей, детей ближе давайте, здесь лучше будет, — от дыма уснут… Братцы, сестры, возвеселитесь… Со святыми нас упокой, — запел, раздувая локтями мантию…

Мужики, глядя на него, задирая бороды, подтягивая, поползли на коленях ближе к аналою."
