TextID,Sentence
50,"Степные горизонты источали такие бодрые запахи, что, будь на месте Остапа какой-нибудь крестьянский писатель-середнячок из группы «Стальное вымя», не удержался бы он – вышел бы из машины, сел бы в траву и тут же бы на месте начал бы писать на листах походного блокнота новую повесть, начинающуюся словами: «Инда взопрели озимые."
50,"Они увезли оттуда большой кувшин топленого молока и сладкое воспоминание об одеколонном запахе сена, на котором спали."
50,"Третий, судя по одуряющему калошному запаху, исходившему от его резинотрестовского плаща, был соотечественник."
50,"Человеку с неотягченной совестью приятно в такое утро выйти из дому, помедлить минуту у ворот, вынуть из кармана коробочку спичек, на которой изображен самолет с кукишем вместо пропеллера и надписью «Ответ Керзону», полюбоваться на свежую пачку папирос и закурить, спугнув кадильным дымом пчелу с золотыми позументами на брюшке."
50,"Персы с печальными лицами калили на жа­ровнях орехи, и угарный дым манил гуляющих."
50,"Козлевич открыл глушитель, и Антилопа утопила первого черноморца в облаке голубого дыма."
50,"Все заволокло синим дымом, автобус покатил дальше, и, когда бензиновая завеса разодралась, Балаганов увидел, что Паниковский окружен небольшой толпой граждан."
50,"Желтое японское солнце светило в упор, затрачивая всю свою силу на освещение такой мелочишки, как граненая пробочка от пузырька с одеколоном «Турандот»."
50,"Женщина с усами закурил трубку, и сладкий запах табаку «Наш кепстен» внес в мятежную душу Берлаги успокоение."
50,Я предпочитаю работать без ладана и астральных колокольчиков.
50,"И не успевал он остановиться, чтобы вытереть пот, как за Адама снова принимался Кушаковский."
50,Воротничок разбух от пота.
50,"– спрашивал Бомзе, от которого несло смешанным запахом одеколона и котлет."
50,"Пропуская сквозь усы папиросный дым, он выпиливал лобзиком из фанеры игрушечный дачный нужник."
50,"Последним из дому, который уже наполнился самоварным дымом с прожилками огня, выскочил Лоханкин, прикрываясь белым одеялом."
50,"На мостовой действительно лежал ящичек, из которого поспешно выбирался густой дым."
50,"Его румяный лоб был влажен от пота и блестел, как блин."
50,"И на самом деле, вместо того, чтобы постараться как можно дольше растянуть последние тридцать четыре рубля, обратив их исключительно на закупку продовольствия, Остап отправился в цветочный магазин и купил за тридцать пять рублей большой, как клумба, шевелящийся букет роз."
50,"– сказал Балаганов, взмахнув букетом."
50,Из ателье бил беспокойный запах грушевой эссенции.
50,Он вышел из машины и снова принялся втягивать ноздрями живительный запах эссенции.
50,А в комнате старого ребусника у букета засохших роз плакала нежная и удивительная.
50,"Засияли широкие стекла мягких вагонов, под самым носом антилоповцев пронеслись букеты и винные бутылки вагона–ресторана, на ходу соскочили проводники с фонарями, и перрон сразу наполнился веселым русским говором и иностранной речью."
50,"Он заснул счастливый под скрипение переборок, вдыхая неповторимый железнодорожный запах краски."
50,"«Не узнал ли кто-нибудь чего-нибудь и не послал ли об этом молнию в свою редакцию?»

Наконец Лавуазьян не сдержался и отправил телеграфное сообщение:

«Проехали оренбург тчк трубы паровоза валит дым тчк молнируйте инструкции аральское море лавуазьян»."
50,"Все послали короткие сообщения о бодром настроении и о трубе паровоза, из коей валит дым."
50,"А тот, иностранец, прямо с ума сходил, посылал ей букеты, конфеты и фильдеперсовые чулки."
50,"Воробьи согревались, клюя горячий навоз."
50,"Воробьи согревались, клюя горячий навоз."
50,"Несколько минут пассажиры молчали, подавленные быстротой передвижения, горячим запахом бензина и свистками ветра."
50,"Цесаревич открыл глушитель, и машина выпустила шлейф синего дыма, от которого зачихали бежавшие за автомобилем собаки."
50,"Степные горизонты источали такие бодрые запахи, что будь на месте Остапа какой-нибудь крестьянский писатель-середнячок из группы «Золотое гумно», не удержался бы он – вышел бы он из машины, сел бы в траву и тут же бы на месте начал бы писать на листах походного блокнота новую повесть, начинающуюся словами: «Инда взопрели озимые...»

Но Остап и его спутники были далеки от поэтических восприятий."
50,"Ночь антилоповцы хорошо отдохнули в деревушке, вдыхая одеколонный запах сена."
50,"Третий, судя по одуряющему калошному запаху, исходившему от его резинотрестовского плаща, был соотечественник."
50,"Человеку с неотягченной совестью приятно в такое утро выйти из дому, помедлить минуту у ворот, с треском выдвинуть из гнезда спичечный ящичек, полюбоваться на свежую пачку папирос и закурить, спугнув кадильным дымом пчелу с золотыми позументами на брюшке."
50,"Засняв тлеющий окурок папиросы в упор, отчего она приняла вид пароходной трубы, извергающей дым и пламя, Крайних-Взглядов обратился к живой натуре."
50,"Персы с печальными лицами калили на жаровнях орехи, и угарный дым манил гуляющих."
50,"Цесаревич открыл глушитель, и Антилопа утопила первого одессита в облаке голубого дыма."
51,"В перерыве мы смущенно закурили из моего запаса махорки, и, пуская дым к верхушке сосен, Задоров вдруг разразился смехом:

— А здорово!"
51,"Но для посторонних миров последнее название мало подходило, ибо от него слишком несло запахом воспитательного ведомства."
51,"Просто был прекрасный теплый весенний день, наполненный запахами подсыхающей земли и солнца."
51,"Но, войдя в спальню, я услышал запах спирта."
51,"И все это не мешало ему день и ночь толочься в конюшне, вычищать навоз, вечно запрягать и распрягать, чистить шлею или уздечку, плести кнут, ездить в любую погоду в город или во вторуб колонию — и всегда жить впроголодь, потому что он никогда не поспевал ни на обед, ни на ужин, и если ему забывали оставить его порцию, он даже и не вспоминал о ней."
51,"— сестра брезгливо смотрит на отсыревшего, пахнущего навозом Антона, к штанам которого прицепились соломинки."
51,Притаились над землей запахи чебреца.
51,"Над заснувшей колонией бродят сны, запахи сосны и чебреца, птичьи шорохи и отзвуки собачьего лая в каком-то далеком государстве."
51,У его ног купается в прохладе и неслышно чапает пятнистый Букет.
51,"Днем шере одновременно можно было видеть и на конюшне, и на постройке оранжереи, и на дороге в город, и на развозке навоза в поле; по крайней мере, у всех было впечатление, что все это происходит в одно и то же время, так быстро переносили Шере его замечательные ноги."
51,"Зимой, когда сельскохозяйственные работы сводились до миниума, все мастерские были наполнены, но уже с января Шере начинал требовать колонистов на парники и навоз и потом с каждым днем увеличивал и увеличивал требования."
51,"Сводный отряд — это временный отряд, составляющийся не больше как на неделю, получающий короткое определенное задание: выполнить картофель на таком-то поле, вспахать такой-то участок, очистить семенной материал, вывезти навоз, произвести посев и так далее."
51,"Что ж вы даете, паразиты: чи его нюхать, чи его исты?"
51,"Он стоял на тротуаре, у витрины отдела снабжения наробраза, и, повернувшись к ней спиной, рассматривал несложные предметы на пыльной, засоренной навозом и соломой улице."
51,"Так же умен и Кудлатый, человек с широким, монгольским лицом, кряжистый и прижимистый.. Он попал к нам прямо из батраков, но в колонии всегда носил кличку «куркуля»; действительно, если бы не колония, приедшая Кудлатого со временем к партийному билету, был бы Кудлатый кулаком: слишком довлел в нем какой-то желудочный, глубокий хозяйственный инстинкт, любовь к вещам, возам, боронам и лошадям, к навозу и вспаханному полю, ко всякой работе во вдоре, в сарае, в амбаре."
51,"Вокруг рта у Ступицына прекрасный букет подвижных точных мускулов, лицо его очень богато мимикой, крутыми и занятными переходами."
51,"Дым от трубки крутым коленом спускается к печке, бурлит двумя рукавами по ушам круглоголового пацана и жадно включается в горячую печную тягу."
51,"При этом, по старой традиции, рьяным считался каждый гражданин, у которого при детальном исследовании обнаруживался слабый запах алкоголя."
51,"Людей с таким или приблизительно таким запахом колонисты умели сразу угадывать среди нескольких сот зрителей и еще лучше имели вытащить из ряда и с позором выставить за двери, безжалостнго пропуская мимо ушей очень похожие на правду уверения:

— Да, честное слово, еще утром кружку пива выпил."
51,"Ось дадим вам по ножу и будете резать, аж пот с вас градом."
51,"Шере, грязный и потный, как и все, проверяет шестеренки и поглядывает на стог, приготовленный к молотьбе."
51,"В воскресенье отдыхали, купались, катались на лодках, возились с новичками, а под вечер вся аристократия, как всегда, собралась у крыльца белого дома, дышала запахами «снежных королев» и, поражая притаившихся в сторонке новичков, вспоминала разные истории."
51,"И в младших группах стал распостраняться запах далекого еще рабфака, и ретивые пацаны часто стали расспрашивать о том, на какой рабфак лучше всего направить им стопы."
51,"Бесконечная конюшня была забита навозом, и в навозных кучах, давно без подстилки и уборки, стояли кое-где классические клячи с выпирающими остряками костей и с испачканными задами, многие плешивые."
51,"Сквозь махорочный дым трудно было разглядеть, сколько сидело человек, но галдеж был порядка двух десятков."
51,Меня прежде всего поразил царящий в колонии запах.
51,"здесь были те же запахи, что и на дворе, минус ладан."
51,"И тоби пасты, и тоби навоз возить, и коровам задницы мыть, а то ж англиець твоего масла исты не захотит, паразит."
51,"Мой глаз в то время был уже достаточно набит, и я умел с первого взгляда, по внешним признакам, по неуловимым гримасам физиономии, по голосу, по походке, еще по каким-то мельчайшим завиткам личности, может быть, даже по запаху, сравнительно точно предсказывать, какая продукция может получиться в каждом отдельном случае из этого сырья."
51,"Зато у него были неоспоримые хозяйственные таланты, способность наладить работу отряда, укладку, перевозку всегда быстро и удачно, пересыпая работу хозяйственным ворчанием и нравоучениями, только потому неутомительными, что от них всегда шел приятный запах Мишиной благонамеренной глупости и неиссякаемой доброты."
51,"А под моими ногами загаженная почва Куряжа, старые стены, пропитанные запахом пота, ладана и клопов, вековые прегрешения попов и кровоточащая грязь беспризорщины."
51,"В пошатнувшейся старой конюшне, по горло утонувшей в навозе, в коровнике, представляющем собой богадельню для десятка старых дев коровьего племени, на всем хозяйском дворе, в изломанной решетке уничтоженного давно сада, по всему пространству, окружавшему меня, торчали засохшие стебли соцвоса."
51,"В черновато-грязном море клифтов, всклокоченных причесок и ржавых запахов мертвыми круглыми пятнами стояли лица, безучастные, первобытные, с открытыми ртами, с шероховатыми взглядами, с мускулами, сделанными из пакли."
51,"В некоторых местах мы ощущали и слабые запахи социального клея, но склеивалось вместе не то, что нам было нужно."
51,"«Второй сорт» беспризорных, отличаясь многими достоинствами, все же не обладает полным букетом благородных нравственных качеств, какими обладает «первый» Эти тоще ищут, но их взоры не отворачиваются с презрением от текстильных фабрик и кожевенных заводов, они готовы помириться даже на деревообделочной мастерской, хуже — они способны заняться картонажным делом, наконец, они не стыдятся собирать лекарственные растения."
51,"— А они жито сеяли, а теперь там живут…

Я услышал запах Халабуды и еще более усомнился:

— Это вы их так дразните?"
51,"Над ними притихшие кроны деревьев, полеты пчел, запахи «снежных королев» и белой акации."
51,"Если тебя, понимаешь, не накормить, ты сдохнешь, вонять будешь тут, неприятно все-таки, да еще гроб тебе делать придется — тоже забота…

Ховрах, наконец, вырывается из Мишиных обьятий и уходит."
51,"Белухин держал в руке букет цветов:

— Это будем встречать пятый отряд, как будто дамы-графини приезжают."
51,"Первый сноп

Последние дни мая по очереди приносили нам новые подарки: новые площадки двора, новые двери и окна, новые запахи во дворе и новые настроения."
51,Сильвестров до холодного пота боялся совета командиров.
51,"В нашем поезде прибавилось жизни, и он летел вперед, обволакивая пахучим веселым дымом широкие поля советских бодрых дней."
51,"Высказывались здесь вежливо, округленными любезными периодами, от которых шел еле уловимый приятный запах мозговых извилин, старых книг и просиженных кресел."
52,"— Некоторые из команды усиленно курили натощак, глотая дым до рвоты, а потом пили воду, крепко настоянную на табаке."
52,"Каждый наш корабль, окутываясь пороховым дымом, отсалютовал в честь кайзера тридцатью одним выстрелом."
52,"— Воробью положено в конском навозе копаться, а он при кортике ходит и повелевает."
52,"Глаза, загораясь животной страстью разыгравшегося аппетита, напряженно смотрели на середину стола, туда, откуда било в нос приятно раздражающим запахом."
52,"Люди работали в промокших от пота платьях, словно только что побывали под дождем."
52,"Он, вероятно, редко мыл голову, но зато часто смазывал густые рыжие волосы лампадным или сливочным маслом, поэтому от них несло тухлым запахом."
52,"А в это время сам отец Паисий, желая угодить начальству, неистово чадил кадилом прямо в нос командиру и старшему офицеру, так что те не знали, куда деваться от едкого дыма ладана, отворачивавшись, морщились, иногда чихали."
52,"Погода часто менялась: ветер то затихал, порхая под ясным небом легким дуновением, то переходил в резкие порывы, нагоняя быстро бегущие облака."
52,"Над нами тихо бродили редкие облака, радостно сияло солнце, легким дуновением ветра умерялась жара."
52,С берега еле уловимый бриз доносил пряный аромат тропических растений.
52,Эскадра окуталась дымом черного пороха.
52,Стройный пирамидальный лес обдал нас запахом гвоздики.
52,"Наши легкие наполнялись горячим и влажным воздухом, полным ароматом цветов и ядовитой прелью погибших растений."
52,"Мы были так мокры от собственного пота, словно только что искупались, не снимая с себя платья."
52,"Если тропическое солнце создало сок сахарного тростника, жгучие пряности и такое обилие разнообразнейших ароматов, то не менее щедро оно было и в творчестве превосходнейших плодов."
