TextID,Sentence
13,"«Становлюсь умнее…»

Память, хотя уже утомленно, все еще перебирала игривые фразы:

«Человек-то дрянцо, фальшивей, тем и живет, что сам себе словесно приятные фокусы показывает, несчастное чадо…»

И звучал сырой булькающий смех."
13,"В сумраке, наполненном тяжелыми запахами, на панелях, у дверей сидели и стояли очень демократические люди, гудел негромкий говорок, сдержанный смех, воющее позевывание."
13,"Эта возня мешала думать, вкусный запах горячего хлеба и липового меда возбуждал аппетит, и думалось только об одном:

«Да, нужно уехать»."
13,Комнату наполнял похожий на угар запах табачного дыма и сухого тления.
13,"В двенадцать лет я начал онанировать, одна из девиц поймала меня на этом и обучила предпочитать нормальную половую жизнь…

Самгин спрятал лицо в дым папиросы, соображая:

«Зачем ему нужно рассказывать эти гадости?"
13,"«Что он хотел сказать?»

За стеклами шкафа блестели золотые надписи на корешках книг, в стекле отражался дым папиросы."
13,"Мир должен быть оправдан весь,
		Чтоб можно было жить,

— четко скандировал приват-доцент, а какой-то сердитый человек басовито кричал:

— Что это — одеколон пролили?"
13,"По вагону, сменяя друг друга, гуляли запахи ветчины, ваксы, жареного мяса, за окном, в сероватом сумраке вечера, двигались снежные холмы, черные деревья, тряслись какие-то прутья, точно грозя высечь поезд, а за спиною Самгина, покашливая, свирепо отхаркиваясь, кто-то мрачно рассказывал:

— Одного ингуша — убили, другого — ранили, трое остальных повезли раненого в город, в больницу и — пропали…

— Сударыня, — торжествующе взывал Пыльников."
13,"Как-то вдруг все запахи заглушил одеколон, а речь Пыльникова покрылась надсадным кашлем и суровой, громко сказанной фразой:

— Не пороть, а руки рубить надо было, руки!"
13,"За окном все гуще падал снег, по стеклам окна ползал синеватый дым папиросы, щекотал глаза, раздражал ноздри, Самгин стоял не двигаясь, ожидая, что вот сейчас родится какая-то необыкновенная, новая и чистая его мысль, неведомая никому, явится и насытит его ощущением власти над хаосом."
13,"«Что она — бредит?» — подумал Самгин, оглядываясь, осматривая маленькую неприбранную комнату, обвешанную толстыми драпировками; в ней стоял настолько сильный запах аптеки, что дым табака не заглушал его."
13,"Она плакала и все более задыхалась, а Самгин чувствовал — ему тоже- тесно и трудно дышать, как будто стены комнаты сдвигаются, выжимая воздух, оставляя только душные запахи."
13,"Самгин оглянулся — все вокруг было неряшливо, неприятно, пропитано душными запахами."
13,"— Вы гораздо больше сказали о нем, — отметил Самгин; Кутузов молча пожал плечами, а затем, прислонясь спиною к стене, держа руки в карманах, папиросу в зубах и морщась от дыма, сказал:

— Была у нее нелепая идея накопить денег и устроить где-то в Сибири нечто в духе Роберта Оуэна… Фаланстер, что ли… Вообще — балаган."
13,"Идти было неудобно и тяжело, снег набивался в галоши, лошади, покрытые черной попоной, шагали быстро, отравляя воздух паром дыхания и кисловатым запахом пота, хрустел снег под колесами катафалка и под ногами четырех человек в цилиндрах, в каких-то мантиях с капюшонами, с горящими свечами в руках."
13,"Она величественно отошла в угол комнаты, украшенный множеством икон и тремя лампадами, села к столу, на нем буйно кипел самовар, исходя обильным паром, блестела посуда, комнату наполнял запах лампадного масла, сдобного теста и меда."
13,И в комнате очень крепкий запах духов.
13,Облако синеватого дыма колебалось над столом.
13,"— Для серьезной оценки этой книги нужно, разумеется, прочитать всю ее, — медленно начал он, следя за узорами дыма папиросы и с трудом думая о том, что говорит."
13,"Уже вечерело, сумрак наполнял комнату, в сумраке искал себе места, расползался дым папиросы."
13,"И — вот…

Он помахал рукой в воздухе, разгоняя дым, искоса следя, как Дронов сосет вино и тоже неотрывно провожает его косыми глазами."
13,"Он знал, что это лицо — сухое, мимически бедное, малоподвижное, каковы почти всегда лица близоруких, но он все чаще видел его внушительным лицом свободного мыслителя, который сосредоточен на изучении своей духовной жизни, на работе своего я. Он снял очки и, почти касаясь лбом стекла, погладил пальцем седоватые волосы висков, покрутил бородку, показал себе желтые мелкие зубы, закопченные дымом табака."
13,"Беднота говорит про них: «бывало — сами водили нас усадьбы жечь, господ сводить с земли, а теперь вот…»

В коридоре стоял душный запах керосина, известковой пыли, тяжелый голос дворника как бы сгущал духоту."
13,"Он очень удивился, когда Иван пришел красный, потный, встал пред ним и торжественно объявил:

— Сделано."
13,"Думая об этом, Клим Иванович Самгин ощущал нервный холодок где-то в спине и жадно глотал одуряющий дым крепкого табака."
13,"Петербург встретил его не очень ласково, в мутноватом небе нерешительно сияло белесое солнце, капризно и сердито порывами дул свежий ветер с моря, накануне или ночью выпал обильный дождь, по сырым улицам спешно шагали жители, одетые тепло, как осенью, от мостовой исходил запах гниющего дерева, дома были величественно скучны."
13,"К басам фисгармонии присоединились альты, дисканта, выпевая что-то зловещее, карающее, звуки ползли в столовую, как дым, а дым папиросы, которую курил Самгин, был слишком крепок и невкусен."
13,"Оно еще в прошлом году ходило, читалось…

Начали спорить по поводу письма, дым папирос и слов тотчас стал гуще."
13,"Было в нем, в костюме и в словах, что-то неряшливое, неуверенное, а вокруг его, в кабинете, неуютно, тесно, стоял запах бумажной пыли."
13,"Юноша шаркнул ногой по полу, исчез, а Самгин, развернув «Дело о взыскании крестьянами Уховыми Иваном и Пелагеей с пот."
13,"В комнате было душновато, крепкие духи женщины не могли одолеть запаха пыли, нагретой центральным отоплением."
13,"Самгин брезгливо стер платком со своей руки ощущение теплого, клейкого пота."
13,"Над столом колебалось сизое облако табачного дыма, в дыму плавали разнообразные физиономии, светились мутноватые глаза, и все вокруг было туманно, мягко, подобно сновидению."
13,"Нагретые за день дома, остывая, дышали тяжелыми запахами из каждых ворот."
13,"Н-да, чорт…

Держа одной рукой стакан вина пред лицом и отмахивая другой дым папиросы Самгина, он помолчал, вздохнул, выпил вино."
13,"Наблюдать — трудно, над столами колеблется пелена сизоватого дыма, и лица людей плохо различимы, они как бы плавают и тают в дыме, все глаза обесцвечены, тусклы."
13,"Прошел обильный дождь, и было очень приятно дышать освеженным воздухом, дождь как будто уничтожил неестественный, но характерный для этого города запах гниения."
13,"— М-м, — промычал Дронов и, захлебнувшись дымом, начал кашлять, присвистывая."
13,"Самгин замолчал, отмечая знакомых: почти бежит, толкая людей, Ногайцев, в пиджаке из чесунчи, с лицом, на котором сияют восторг и пот, нерешительно шагает длинный Иеронимов, держа себя пальцами левой руки за ухо, наклонив голову, идет Пыльников под руку с высокой дамой в белом и в необыкновенной шляпке, важно выступает Стратонов с толстой палкой в руке, рядом с ним дергается Пуришкевич, лысенький, с бесцветной бородкой, и шагает толсторожий Марков, похожий на празднично одетого бойца с мясной бойни."
13,"— Немецкие социалисты — наши учителя, — ворковал Шемякин, — уже в прошлом году голосовали за новые налоги специально на вооружение…

Из переулка, точно дым из трубы, быстро, одна за другою, выкатывались группы людей с иконами в руках, с портретом царя, царицы, наследника, затем выехал, расталкивая людей лошадью, пугая взмахами плети, чернобородый офицер конной полиции, закричал:

— Вам сказано: отставить!"
13,"Он хотел бы застать в кухне мужчину, но, кроме Беньковского, не видел ни одного, хотя какие-то мужчины бывали: Агафья не курила, Беньковский — тоже, но в кухне всегда чувствовался запах табака."
13,"По бокам дороги в тумане плывут деревья, качаются черные ветки, оголенные осенним ветром, суетливо летают и трещат белобокие сороки, густой запах болотной гнили встречает и провожает гремучую бричку, сырость, всасываясь в кожу, вызывает тягостное уныние и необычные мысли."
13,В комнате стоял тяжкий запах какой-то кислой сырости.
13,"Комнату наполняло ласковое, душистое тепло, медовый запах ласкал обоняние, и хотелось, чтоб вся кожа погрузилась в эту теплоту, подышала ею."
13,"— Их ученые, историки нередко заявляли, что славяне — это удобрение, грубо говоря — навоз для немцев, и что к нам можно относиться, как американцы относятся к неграм…

— Гляди-ко ты!"
13,"— возражал Фроленков, наполняя рюмки светложелтой настойкой медового запаха."
13,"Жирные, удушливые кухонные запахи густо вытекали из окна."
13,"Он снова вынул флягу, налил коньяку в чашки, Самгин поблагодарил, выпил и почувствовал, что коньяк имеет что-то родственное с одеколоном."
13,"Фасад двухэтажного деревянного дома дымился белым дымом, в нем что-то выло, скрипело."
13,"Стиснутые в одно плотное, многоглавое тело, люди двигались всё ближе к Самгину, от них исходил густой, едкий запах соленой рыбы, детских пеленок, они кричали;

— Почему нас не пускают в город?"
13,"— Контрабандисты и шпионы…

Крик и плач раздражали Самгина, запах, становясь все тяжелее, затруднял дыхание, но всего мучительнее было ощущать, как холод жжет ноги, пальцы сжимались, точно раскаленными клещами."
13,"Все это совершалось [в] синеватом сумраке, наполненном дымом махорки, сумрак становился гуще, а вздохи, вой и свист ветра в трубе печи — слышнее."
13,"В сыроватой и сумрачной духоте, кроме крепкого дыма махорки, был слышен угарный запах древесного угля."
13,"В пекарне стоял застарелый запах квашеного теста, овчины, кишечного газа."
13,"Следствие вел провинциальный чиновник, мудрец весьма оригинальной внешности, высокий, сутулый, с большой тяжелой головой, в клочьях седых волос, встрепанных, точно после драки, его высокий лоб, разлинованный морщинами, мрачно украшали густейшие серебряные брови, прикрывая глаза цвета ржавого железа, горбатый, ястребиный нос прятался в плотные и толстые, точно литые, усы, седой волос усов очень заметно пожелтел от дыма табака."
13,"Город натискан беженцами, ранеными, отдыхающими от военных трудов, спекулянтами, шулерами и всяким мародерством и дерьмом."
13,"Одно из двух окон в сад было открыто, там едва заметно и беззвучно шевелились ветви липы, в комнату втекал ее аптечный запах, вползали неопределенные [шорохи?"
13,"Дым, тяжело и медленно поднимаясь от земли, сливается с горячим, влажным воздухом, низко над людями висит серое облако, дым напитан запахами болота и человечьего навоза."
13,"Говоря задумчиво, он смотрел в землю, под ноги Самгина, едкий зеленоватый дым облекал его слова."
13,"Самгин не встречался с ним несколько месяцев, даже не вспоминал о нем, но однажды, в фойе театра Грановской, во время антракта, Дронов наскочил на него, схватил за локоть, встряхнул руку и, веселыми глазами глядя под очки Самгина, выдыхая запах вина, быстро выразил радость встречи, рассказал, что утром приехал из Петрозаводска, занят поставками на Мурманскую дорогу."
13,"Самгин не удивился, встретив у Елены человека в форме английского офицера, в зубах его дымилась трубка, дым окутывал лицо голубоватой вуалью, не сразу можно было вспомнить, что это — мистер Крэйтон."
13,"Затем в десятый раз припомнились стихи Брюсова о «грядущих гуннах» и чьи-то слова по поводу осуждения на каторгу депутатов-социалистов:

«Пятерых — осудили в каторгу, пятьсот поймут этот приговор как вызов им…»

Сидя за столом, поддерживая голову ладонью, Самгин смотрел, как по зеленому сукну стелются голубые струйки дыма папиросы, если дохнуть на них — они исчезают."
13,"На столе в облаке пара большой самовар, слышен запах углей, чай порывисто, угловато разливает черноволосая женщина с большим жестким лицом, и кажется, что это от нее исходит запах углекислого газа."
13,"На оратора смотрели сердито хмурясь, пренебрежительно улыбаясь, а сидевший впереди Самгина бритый и какой-то насквозь серый человек бормотал, точно окуня выудив:

— Ага, вот он, вот он…

Литератор откинулся пред ним на спинку стула, его красивое лицо нахмурилось, покрылось серой тенью, глаза как будто углубились, он закусил губу, и это сделало рот его кривым; он взял из коробки на столе папиросу, женщина у самовара вполголоса напомнила ему:

«Ты бросил курить!», тогда он, швырнув папиросу на мокрый медный поднос, взял другую и закурил, исподлобья и сквозь дым глядя на оратора."
13,"По стеклам окна ползал дым папиросы, за окном, во тьме, прятались какие-то холодные огни, изредка вспыхивал новый огонек, скользил, исчезал, напоминая о кометах и о жизни уже не на окраине города, а на краю какой-то глубокой пропасти, неисчерпаемой тьмы."
13,"Затем — Ленин, это, знаешь, крупнейший политический мыслитель…

Он замолчал, отмахиваясь от дыма, потом заметил:

— Много ты куришь!"
13,"Все громче звучала медная мелодия гимна Франции, в воздухе колебался ворчливый гул, и на него иронически ненужно ложились слова егеря:

— Настоящих господ по запаху узнаешь, у них запах теплый, собаки это понимают… Господа — от предков сотнями годов приспособлялись к наукам, чтобы причины понимать, и достигли понимания, и вот государь дал им Думу, а в нее набился народ недостойный."
14,"Еще работать можешь, -поди вот дворнику моему помоги навоз убрать - семишник дам... 

В периоды увлечения работой он к людям относился сурово и безжалостно, он и себе покоя не давал, ловя рубли."
14,"И неожиданно являлся домой еще весь пропитанный запахом кабаков, но уже подавленный и тихий."
14,"Священник пришел и, закрыв чем-то лицо ее, стал, вздыхая, читать над нею умоляющие слова: 

- ""Владыко господи вседержителю, исцеляяй всякий недуг... и сию, днесь родившую, рабу твою Наталью исцели... и восстави ю от одра, на нем же лежит... зане, по пророка Давида словеси:"" в беззакониях зачахомся и сквернави вси есмы пред тобою..."" 

Голос старика прерывался, худое лицо было строго, от одежд его пахло ладаном."
14,"Семья была благочестива - запах воска, ладана и лампадного масла наполнял дом, покаянные вздохи, молитвенные слова носились в воздухе."
14,А потам Тарас пропал без вести.
14,"То тут, то там, по горе и в лугах, являются селенья, солнце сверкает на стеклах окон изб и на парче соломенных крыш, сияют, в зелени деревьев, кресты церквей, лениво кружатся в воздухе серые крылья мельниц, дым из трубы завода вьется в небо."
