TextID,Sentence
1,"В кабинете, полном дыма, шел разговор о войне, которая была объявлена манифестом, о наборе."
1,"Один из говоривших был штатский, с морщинистым, желчным и бритым худым лицом, человек, уже приближавшийся к старости, хотя и одетый, как самый модный молодой человек; он сидел с ногами на оттоманке с видом домашнего человека и, сбоку запустив себе далеко в рот янтарь, порывисто втягивал дым и жмурился."
1,"– Ну, сударыня, – начал старик, пригнувшись близко к дочери над тетрадью и положив одну руку на спинку кресла, на котором сидела княжна, так что княжна чувствовала себя со всех сторон окруженною тем табачным и старчески-едким запахом отца, который она так давно знала."
1,"Виноват ли был учитель, или виновата была ученица, но каждый день повторялось одно и то же: у княжны мутилось в глазах, она ничего не видела, не слышала, только чувствовала близко подле себя сухое лицо строгого отца, чувствовала его дыхание и запах и только думала о том, как бы ей уйти поскорее из кабинета и у себя на просторе понять задачу."
1,"Хозяин-немец, в фуфайке и колпаке, с вилами, которыми он вычищал навоз, выглянул из коровника."
1,"Денисов улыбнулся, достал из ташки платок, распространявший запах духов, и сунул в нос Несвицкому."
1,"– Да как же, батюшка, – заговорил, остановившись, Несвицкий, снимая фуражку и расправляя пухлою рукой мокрые от пота волосы, – как же не говорил, что мост зажечь, когда горючие вещества положили?"
1,С моста поднялся густой дым.
1,"– сказал князь Андрей, живо воображая себе серые шинели, раны, пороховой дым, звуки пальбы и славу, которая ожидает его."
1,"Прямо против батареи, на горизонте противоположного бугра, виднелась деревня Шенграбен; левее и правее можно было различить в трех местах среди дыма их костров массы французских войск, которых, очевидно, большая часть находилась в самой деревне и за горою."
1,"Левее деревни, в дыму, казалось что-то похожее на батарею, но простым глазом нельзя было рассмотреть хорошенько."
1,"XVII

Князь Андрей верхом остановился на батарее, глядя на дым орудия, из которого вылетело ядро."
1,"Еще дым первого выстрела не рассеялся, как показался другой дымок и выстрел."
1,"В то время как он подъезжал, из орудия этого, оглушая его и свиту, зазвенел выстрел, и в дыму, вдруг окружившем орудие, видны были артиллеристы, подхватившие пушку и, торопливо напрягаясь, накатывавшие ее на прежнее место."
1,"XVIII

Князь Багратион, выехав на самый высокий пункт нашего правого фланга, стал спускаться книзу, где слышалась перекатная стрельба и ничего не видно было от порохового дыма."
1,"Впереди, в дыму, уже были видны ряды серых шинелей, и офицер, увидав Багратиона, с криком побежал за солдатами, шедшими толпой, требуя, чтоб они воротились."
1,Весь воздух пропитан был пороховым дымом.
1,"Но в кого они стреляли, этого не было видно от порохового дыма, не уносимого ветром."
1,"Вдруг между французами треснул один выстрел, другой, третий… и по всем расстроившимся неприятельским рядам разнесся дым и затрещала пальба."
1,Генерал закашлялся от крика и порохового дыма и остановился в отчаянии.
1,"Дым-то, дым-то!"
1,"В дыму, оглушаемый беспрерывными выстрелами, заставлявшими его каждый раз вздрагивать, Тушин, не выпуская своей носогрелки, бегал от одного орудия к другому, то прицеливаясь, то считая заряды, то распоряжаясь переменой и перепряжкой убитых и раненых лошадей, и покрикивал своим слабым, тоненьким, нерешительным голоском."
1,"Неприятельские пушки в его воображении были не пушки, а трубки, из которых редкими клубами выпускал дым невидимый курильщик."
1,"XXI

Ветер стих, черные тучи низко нависли над местом сражения, сливаясь на горизонте с пороховым дымом."
1,"Он слышал тепло ее тела, запах духов и слышал скрып ее корсета при дыхании."
1,"То двигались тысячи ног и штыков с развевавшимися знаменами и по команде офицеров останавливались, заворачивались и строились в интервалах, обходя другие такие же массы пехоты в других мундирах; то мерным топотом и бряцанием звучала нарядная кавалерия в синих, красных, зеленых шитых мундирах с расшитыми музыкантами впереди, на вороных, рыжих, серых лошадях; то, растягиваясь с своим медным звуком подрагивающих на лафетах, вычищенных, блестящих пушек и с своим запахом пальников, ползла между пехотой и кавалерией артиллерия и расставлялась на назначенных местах."
1,"Сражение, состоявшее только в том, что захвачен эскадрон французов, было представлено как блестящая победа над французами, и потому государь и вся армия, особенно пока не разошелся еще пороховой дым на поле сражения, верили, что французы побеждены и отступают против своей воли."
1,"Дым от костров, в которые бросали все лишнее, ел глаза."
1,"Колонны двигались, не зная куда и не видя от окружавших людей, от дыма и от усиливающегося тумана ни той местности, из которой они выходили, ни той, в которую они вступали."
1,"Но в тот же миг все застлалось дымом, раздалась близкая стрельба, и наивно испуганный голос в двух шагах от князя Андрея закричал: «Ну, братцы, шабаш!» И как будто голос этот был команда."
1,"Выбравшись из толпы бегущих, князь Андрей, стараясь не отставать от Кутузова, увидал на спуске горы, в дыму, еще стрелявшую русскую батарею и подбегающих к ней французов."
1,"Видны были, по блеску штыков между дымом, двигавшиеся массы пехоты и узкие полосы артиллерии с зелеными ящиками."
1,"Ростов на пригорке остановил на минуту лошадь, чтобы рассмотреть то, что делалось; но как он ни напрягал внимание, он ничего не мог ни понять, ни разобрать из того, что делалось: двигались там в дыму какие-то люди, двигались и спереди и сзади какие-то холсты войск; но зачем?"
1,"Дальше нельзя было ничего видеть, потому что тотчас же после этого откуда-то стали стрелять пушки и все застлалось дымом."
1,"В ту минуту как кавалергарды, миновав его, скрылись в дыму, Ростов колебался, скакать ли ему за ними или ехать туда, куда ему нужно было."
1,"Дым, особенно густой от тумана, помешал ему видеть в первое мгновение; но другого выстрела, которого он ждал, не последовало."
1,"Только слышны были торопливые шаги Долохова, и из-за дыма показалась его фигура."
1,"Потом потушили свечи, зажгли спирт, как это слышал по запаху Пьер, и сказали, что он увидит малый свет."
1,"«Все кончено», – подумал он, и холодный пот выступил у него на лбу."
1,"Я чувствую, что, кроме меня, надо мной живут духи и что в этом мире есть правда."
1,"Как только Ростов вошел в двери дома, его обхватил запах гниющего тела и больницы."
1,"Больничный запах был так силен в этом темном коридоре, что Ростов схватился за нос и должен был остановиться, чтобы собраться с силами и идти дальше."
1,"Запах, к которому он уже успел придышаться в коридоре, здесь был еще сильнее."
1,"Запах этот здесь несколько изменился: он был резче, и чувствительно было, что отсюда-то именно он и происходил."
1,"«И как они могут не только хохотать, но жить тут?» – думал Ростов, все слыша еще этот запах мертвого тела, которого он набрался в солдатском госпитале, и все еще видя вокруг себя эти завистливые взгляды, провожавшие его с обеих сторон, и лицо этого молодого солдата с закаченными глазами."
1,"Ему так живо казалось, что он теперь чувствует этот больничный запах мертвого тела, что он оглядывался, чтобы понять, откуда мог происходить этот запах."
1,"Запах еды преображенцев и голод вызвали его из этого состояния: надо было поесть что-нибудь, прежде чем уехать."
1,"Неприятно… А моя невеста… Вот будете приходить к нам… – продолжал Берг, он хотел сказать – обедать, но раздумал и сказал: «чай пить», и, проткнув его быстро языком, выпустил круглое маленькое колечко табачного дыма, олицетворявшее вполне его мечты о счастии."
1,– Вот вам духи.
1,В кабинете слышался сильный запах табаку и собак.
1,"Наташа ела все, и ей показалось, что подобных лепешек на юраге, с таким букетом варений, на меду орехов и такой курицы никогда она нигде не видала и не едала."
1,"В деревне, которую проезжали, были красные огоньки и весело пахло дымом."
1,"Он вглядывался, и, когда узнавал все ту же и другую и вспоминал этот запах пробки, смешанный с чувством поцелуя, он полной грудью вдыхал в себя морозный воздух, и, глядя на уходящую землю и блестящее небо, он чувствовал себя опять в волшебном царстве."
1,"Пожалуйста, поезжайте, – сказал он и, протянув руку к ее букету и понижая голос, сказал: – Vous serez la plus jolie."
1,Белая пухлая шея его резко выступала из-за черного воротника мундира; от него пахло одеколоном.
1,"Та же степенность, та же чистота, та же тишина были в этом доме, те же мебели, те же стены, те же звуки, тот же запах и те же робкие лица, только несколько постаревшие."
1,"Уланы близко налетели на французских драгун, что-то спуталось там в дыму, и через пять минут уланы понеслись назад не к тому месту, где они стояли, но левее."
1,"Петя отер руками пот, покрывавший его лицо, и поправил размочившиеся от пота воротнички, которые он так хорошо, как у больших, устроил дома."
1,"Было уже поздно, и Петя ничего не ел, и пот лил с него градом; но он не уходил домой и вместе с уменьшившейся, но еще довольно большой толпой стоял перед дворцом во время обеда государя, глядя в окна дворца, ожидая еще чего-то и завидуя одинаково и сановникам, подъезжавшим к крыльцу – к обеду государя, и камер-лакеям, служившим за столом и мелькавшим в окнах."
1,"Опять, но очень близко этот раз, засвистело что-то, как сверху вниз летящая птичка, блеснул огонь посередине улицы, выстрелило что-то и застлало дымом улицу."
1,Прежде ясное вечернее небо все было застлано дымом.
1,"И сквозь этот дым странно светил молодой, высоко стоящий серп месяца."
1,С двух сторон поднимались и расходились черные клубы дыма от пожаров.
1,"Увидав дым и даже огни пожаров, видневшиеся теперь в начинавшихся сумерках, бабы, до тех пор молчавшие, вдруг заголосили, глядя на пожары."
1,На небе были звезды и светился изредка застилаемый дымом молодой месяц.
1,"Пламя то замирало и терялось в черном дыме, то вдруг вспыхивало ярко, до странности отчетливо освещая лица столпившихся людей, стоявших на перекрестке."
1,"– вторя завалившемуся потолку амбара, из которого несло запахом лепешек от сгоревшего хлеба, заревела толпа."
1,"– Видите ли, это трудно вам объяснить… Вчера левый фланг наш был вот там, в Шевардине, вон, видите, где дуб; а теперь мы отнесли назад левое крыло, теперь вон, вон – видите деревню и дым?"
1,"– Да, приятный запах."
1,"В отверстие сломанной стены он смотрел на шедшую вдоль по забору полосу тридцатилетних берез с обрубленными нижними сучьями, на пашню с разбитыми на ней копнами овса и на кустарник, по которому виднелись дымы костров – солдатских кухонь."
1,"И эти березы с их светом и тенью, и эти курчавые облака, и этот дым костров – все вокруг преобразилось для него и показалось чем-то страшным и угрожающим."
1,"Другой камердинер, придерживая пальцем склянку, брызгал одеколоном на выхоленное тело императора с таким выражением, которое говорило, что он один мог знать, сколько и куда надо брызнуть одеколону."
1,"Костры не ярко горели вблизи, во французской гвардии, и далеко сквозь дым блестели по русской линии."
1,"Это была та же панорама, которою он любовался вчера с этого кургана; но теперь вся эта местность была покрыта войсками и дымами выстрелов, и косые лучи яркого солнца, поднимавшегося сзади, левее Пьера, кидали на нее в чистом утреннем воздухе пронизывающий с золотым и розовым оттенком свет и темные, длинные тени."
1,"К этому туману присоединялся дым выстрелов, и по этому туману и дыму везде блестели молнии утреннего света – то по воде, то по росе, то по штыкам войск, толпившихся по берегам и в Бородине."
1,"И все это двигалось или казалось движущимся, потому что туман и дым тянулись по всему этому пространству."
1,"Как в этой местности низов около Бородина, покрытых туманом, так и вне его, выше и особенно левее по всей линии, по лесам, по полям, в низах, на вершинах возвышений, зарождались беспрестанно сами собой из ничего, пушечные, то одинокие, то гуртовые, то редкие, то частые клубы дымов, которые, распухая, разрастаясь, клубясь, сливаясь, виднелись по всему этому пространству."
1,– раздавался через секунду звук этого дыма.
1,"«Пуф-пуф» – поднимались два дыма, толкаясь и сливаясь; и «бум-бум» – подтверждали звуки то, что видел глаз."
1,"Пьер оглядывался на первый дым, который он оставил округлым плотным мячиком, и уже на месте его были шары дыма, тянущегося в сторону, и пуф… (с остановкой) пуф-пуф – зарождались еще три, еще четыре, и на каждый, с теми же расстановками, бум… бум-бум-бум, – отвечали красивые, твердые, верные звуки."
1,"Пьеру захотелось быть там, где были эти дымы, эти блестящие штыки и пушки, это движение, эти звуки."
1,"Пьер видел, что впереди его был мост и что с обеих сторон моста и на лугу, в тех рядах лежащего сена, которые он заметил вчера, в дыму что-то делали солдаты; но, несмотря на неумолкающую стрельбу, происходившую в этом месте, он никак не думал, что тут-то и было поле сражения."
1,"Проехав в дыму по шестому корпусу, позади артиллерии, которая, выдвинутая вперед, стреляла, оглушая своими выстрелами, они приехали к небольшому лесу."
1,"Пушки с этой батареи беспрестанно одна за другой стреляли, оглушая своими звуками и застилая всю окрестность пороховым дымом."
1,"Перекатная пальба пушек и ружей усиливалась по всему полю, в особенности влево, там, где были флеши Багратиона, но из-за дыма выстрелов с того места, где был Пьер, нельзя было почти ничего видеть."
1,"Ряды пехотных солдат скрылись в дыму, послышался их протяжный крик и частая стрельба ружей."
1,"Но солнце, застилаемое дымом, стояло еще высоко, и впереди, и в особенности налево у Семеновского, кипело что-то в дыму, и гул выстрелов, стрельба и канонада не только не ослабевали, но усиливались до отчаянности, как человек, который, надрываясь, кричит из последних сил."
1,"Потом, когда дым застлал все поле, в этом дыму двинулись (со стороны французов) справа две дивизии, Дессе и Компана, на флеши, и слева полки вице-короля на Бородино."
1,"От Шевардинского редута, на котором стоял Наполеон, флеши находились на расстоянии версты, а Бородино более чем в двух верстах расстояния по прямой линии, и потому Наполеон не мог видеть того, что происходило там, тем более что дым, сливаясь с туманом, скрывал всю местность."
1,"Как скоро они спустились в овраг, дым выстрелов орудийных и ружейных на флешах стал так густ, что застлал весь подъем той стороны оврага."
1,"Сквозь дым мелькало там что-то черное – вероятно, люди, и иногда блеск штыков."
1,"Дым стлался перед флешами, и то казалось, что дым двигался, то казалось, что войска двигались."
